{
    "batch_id": "multisector_prod_20260403_130148",
    "language": "es",
    "dataset_version": "1.0.0",
    "memory_type": "agent_training",
    "intents_expansion": [
        {
            "intent": "SOLVE_UNIT_CONVERSION",
            "action": "builder.install_playbook",
            "utterances_explicit": [
                "pierdo plata con los cables",
                "compro por rollo y vendo por metro",
                "no me cuadra el inventario suelto",
                "se me descuadra el stock cuando vendo por unidades",
                "necesito convertir cajas a unidades",
                "vendo por metro pero compro por caja",
                "el excel no me calcula conversion de unidades",
                "quiero controlar inventario fraccionado",
                "no se cuanto cable real me queda",
                "en ferreteria vendo suelto y no cuadra",
                "necesito factor de conversion por producto",
                "mis clavos vienen en caja y salen por unidad",
                "quiero alerta cuando quede poco por metro",
                "la varilla la compro en paquete y vendo por pieza",
                "el sistema no entiende unidad compra y venta",
                "quiero descontar inventario por fracciones",
                "como manejo productos por rollo y metro",
                "se me pierde material en conversion",
                "quiero saber stock real por unidad vendible",
                "mi bodega no controla conversiones",
                "necesito inventario para ferreteria por factor",
                "no quiero seguir con formulas manuales en excel"
            ],
            "utterances_implicit": [
                "quiero que me sugieras campos para conversion",
                "tengo ferreteria y necesito control por metros",
                "me quedo sin material por mal calculo de conversion",
                "quiero control de entradas y salidas por fraccion",
                "no tengo alerta de reabastecimiento por metro",
                "quiero mata excel para conversion de unidades",
                "como configuro unidad_compra y unidad_venta",
                "quiero app para inventario de ferreteria con conversion",
                "quiero ferreteria con factor_conversion",
                "sugiereme tabla para vender suelto",
                "no me sirve el pos para conversion de unidades",
                "necesito controlar materiales por medida",
                "quiero descontar metros exactos del rollo",
                "necesito pierdo plata con los cables",
                "quiero pierdo plata con los cables",
                "me urge pierdo plata con los cables",
                "ayudame a pierdo plata con los cables",
                "como hago para pierdo plata con los cables",
                "no se como pierdo plata con los cables",
                "tengo problema con pierdo plata con los cables",
                "necesito compro por rollo y vendo por metro",
                "quiero compro por rollo y vendo por metro",
                "me urge compro por rollo y vendo por metro"
            ],
            "hard_negatives": [
                "elecciones presidenciales",
                "partido de futbol",
                "resultado de loteria",
                "precio del bitcoin",
                "historia clinica",
                "reserva hotel",
                "diezmo",
                "matricula escolar",
                "gestion de reciclaje empresarial",
                "academia de programacion kids"
            ],
            "slots": [
                {
                    "name": "sector_id",
                    "required": true
                }
            ],
            "one_question_policy": [
                {
                    "missing_slot": "sector_id",
                    "question": "¿Para qué sector necesitas activar el playbook?"
                }
            ],
            "confirm_required": false,
            "success_reply_template": "He activado el playbook de SOLVE_UNIT_CONVERSION con éxito.",
            "error_reply_template": "Lo siento, no pude activar el playbook de SOLVE_UNIT_CONVERSION."
        },
        {
            "intent": "SOLVE_EXPIRY_CONTROL",
            "action": "builder.install_playbook",
            "utterances_explicit": [
                "se me vencen los medicamentos",
                "quiero control de fechas de vencimiento",
                "necesito alerta por lotes proximos a vencer",
                "no quiero perder dinero por productos vencidos",
                "quiero manejar fefo en farmacia",
                "no tengo trazabilidad por lote",
                "quiero saber dias restantes para vencer",
                "me da miedo vender un lote vencido",
                "en drogueria revisamos vencimiento a mano",
                "quiero app para controlar vencimientos",
                "necesito semaforo rojo amarillo para vencidos",
                "quiero retirar de vitrina lo que vence pronto",
                "quiero promocionar lotes que vencen",
                "no me cuadra inventario por lote",
                "quiero lotes con fecha_vencimiento",
                "necesito control legal de caducidad",
                "tengo perdida por medicinas vencidas",
                "quiero registro de lotes en stock",
                "quiero farmacia con alertas de vencimiento",
                "no quiero revisar caja por caja",
                "me ayudas con control de caducidad",
                "quiero dashboard de lotes por vencer"
            ],
            "utterances_implicit": [
                "quiero notificacion cuando falten 30 dias",
                "como organizo inventario por lotes",
                "necesito trazabilidad de insumos medicos",
                "quiero saber que lote vender primero",
                "quiero fefo en mi mini app",
                "tengo productos sin fecha clara",
                "quiero monitoreo de fechas de vencimiento",
                "sugiereme tablas para farmacia por lote",
                "quiero evitar riesgo sanitario por vencidos",
                "quiero control de vencimientos para alimentos",
                "me ayudas a configurar alerta roja por vencido",
                "quiero checklist de vencimientos diario",
                "quiero app de farmacia con lotes y alertas",
                "necesito se me vencen los medicamentos",
                "quiero se me vencen los medicamentos",
                "me urge se me vencen los medicamentos",
                "ayudame a se me vencen los medicamentos",
                "como hago para se me vencen los medicamentos",
                "no se como se me vencen los medicamentos",
                "tengo problema con se me vencen los medicamentos",
                "necesito quiero control de fechas de vencimiento",
                "quiero quiero control de fechas de vencimiento",
                "me urge quiero control de fechas de vencimiento"
            ],
            "hard_negatives": [
                "elecciones presidenciales",
                "partido de futbol",
                "resultado de loteria",
                "precio del bitcoin",
                "canon de arriendo",
                "reserva de salon",
                "pedido web",
                "ruta de entrega",
                "gestion de reciclaje empresarial",
                "academia de programacion kids"
            ],
            "slots": [
                {
                    "name": "sector_id",
                    "required": true
                }
            ],
            "one_question_policy": [
                {
                    "missing_slot": "sector_id",
                    "question": "¿Para qué sector necesitas activar el playbook?"
                }
            ],
            "confirm_required": false,
            "success_reply_template": "He activado el playbook de SOLVE_EXPIRY_CONTROL con éxito.",
            "error_reply_template": "Lo siento, no pude activar el playbook de SOLVE_EXPIRY_CONTROL."
        },
        {
            "intent": "SOLVE_RECIPE_COSTING",
            "action": "builder.install_playbook",
            "utterances_explicit": [
                "no se cuanto me cuesta cada plato",
                "quiero escandallo automatico",
                "quiero calcular margen real por receta",
                "la comida sube de precio y no lo controlo",
                "pierdo plata por merma en cocina",
                "quiero costeo por gramos",
                "quiero controlar desperdicio por receta",
                "necesito saber rentabilidad por producto",
                "el excel de recetas se rompio",
                "quiero receta con ingredientes y costos",
                "quiero alerta cuando suba costo del ingrediente",
                "quiero calcular costo total del plato",
                "quiero margen de ganancia real",
                "quiero restaurante con control de mermas",
                "quiero saber plato estrella y rentable",
                "necesito costo por porcion exacto",
                "quiero comparar precio venta vs costo real",
                "quiero ver perdida mensual por desperdicio",
                "quiero control de insumos por receta",
                "me ayudas a costear menu",
                "quiero app para escandallo de heladeria",
                "quiero controlar cono por gramos"
            ],
            "utterances_implicit": [
                "no tengo indicador de rentabilidad de cocina",
                "quiero sugerencia de precio por margen",
                "como hago costeo de recetas sin excel",
                "quiero dashboard de costos de alimentos",
                "necesito costear productos de cafeteria",
                "quiero ver merma por turno",
                "quiero saber que plato deja mas dinero",
                "quiero mini app de recetas y costos",